A1: Stack and Compiler Versions
A2: TCP/IP Stack v5.36
A3: MPLAB C Compiler for PIC18 MCUs (C18) v3.38
A4: MPLAB C Compiler for PIC24 MCUs and dsPIC DSCs (C30) v3.25
A5: MPLAB C Compiler for PIC32 MCUs (C32) v1.12
A7: Microcontroller | B7: MIPS | C7: Network Controller | D7: Interface | E7: LAN Transmit Throughput (Kbytes/sec) | I7: Internet Transmit Throughput at 100ms ping (estimated Kbytes/sec)(1) | M7: Compiler | N7: Optimization | O7: Test Boards
E8: TCP with 200 byte TX FIFO | F8: TCP with 2000 byte TX FIFO | G8: TCP with 8000 byte TX FIFO | H8: UDP | I8: TCP with 200 byte TX FIFO | J8: TCP with 2000 byte TX FIFO | K8: TCP with 8000 byte TX FIFO | L8: UDP
A9: PIC18F97J60 | B9: 10.4 | C9: Internal 10BaseT | D9: - | E9: 34 | F9: 76 | G9: N/A | H9: 113 | I9: =IF(E9>0.2/0.1, IF(ISNUMBER(E9),0.2/0.1,E9),E9) -> 2 | J9: =IF(F9>2/0.1, IF(ISNUMBER(F9),2/0.1,F9),F9) -> 20 | K9: =IF(G9>8/0.1, IF(ISNUMBER(G9),8/0.1,G9),G9) -> N/A | L9: =H9 -> 113 | M9: C18 | N9: Debug | O9: PICDEM.net 2
A10: PIC18F8722 | B10: 10 | C10: ENC28J60 | D10: SPI, 10 MHz | E10: 20 | F10: 45 | G10: N/A | H10: 63 | I10: =IF(E10>0.2/0.1, IF(ISNUMBER(E10),0.2/0.1,E10),E10) -> 2 | J10: =IF(F10>2/0.1, IF(ISNUMBER(F10),2/0.1,F10),F10) -> 20 | K10: =IF(G10>8/0.1, IF(ISNUMBER(G10),8/0.1,G10),G10) -> N/A | L10: =H10 -> 63 | M10: C18 | N10: Debug | O10: PIC18 Explorer, Ethernet PICtail
A11: PIC24FJ128GA010 | B11: 16 | C11: ENC28J60 | D11: SPI, 8 MHz | E11: 55 | F11: 136 | G11: N/A | H11: 201 | I11: =IF(E11>0.2/0.1, IF(ISNUMBER(E11),0.2/0.1,E11),E11) -> 2 | J11: =IF(F11>2/0.1, IF(ISNUMBER(F11),2/0.1,F11),F11) -> 20 | K11: =IF(G11>8/0.1, IF(ISNUMBER(G11),8/0.1,G11),G11) -> N/A | L11: =H11 -> 201 | M11: C30 | N11: s (min size) | O11: Explorer 16, Ethernet PICtail Plus
A12: dsPIC33FJ256GP710(2) | B12: 40 | C12: ENC28J60 | D12: SPI, 8 MHz | E12: 60 | F12: 170 | G12: N/A | H12: 254 | I12: =IF(E12>0.2/0.1, IF(ISNUMBER(E12),0.2/0.1,E12),E12) -> 2 | J12: =IF(F12>2/0.1, IF(ISNUMBER(F12),2/0.1,F12),F12) -> 20 | K12: =IF(G12>8/0.1, IF(ISNUMBER(G12),8/0.1,G12),G12) -> N/A | L12: =H12 -> 254 | M12: C30 | N12: s (min size) | O12: Explorer 16, Ethernet PICtail Plus
A13: PIC32MX360F512L | B13: 80 | C13: ENC28J60 | D13: SPI, 20 MHz | E13: 92 | F13: 275 | G13: N/A | H13: 433 | I13: =IF(E13>0.2/0.1, IF(ISNUMBER(E13),0.2/0.1,E13),E13) -> 2 | J13: =IF(F13>2/0.1, IF(ISNUMBER(F13),2/0.1,F13),F13) -> 20 | K13: =IF(G13>8/0.1, IF(ISNUMBER(G13),8/0.1,G13),G13) -> N/A | L13: =H13 -> 433 | M13: C32 | N13: s (min size) | O13: Explorer 16, Ethernet PICtail Plus
A14: PIC32MX795F512L | B14: 80 | C14: ENC28J60 | D14: SPI, 20 MHz | E14: 95 | F14: 286 | G14: N/A | H14: 440 | I14: =IF(E14>0.2/0.1, IF(ISNUMBER(E14),0.2/0.1,E14),E14) -> 2 | J14: =IF(F14>2/0.1, IF(ISNUMBER(F14),2/0.1,F14),F14) -> 20 | K14: =IF(G14>8/0.1, IF(ISNUMBER(G14),8/0.1,G14),G14) -> N/A | L14: =H14 -> 440 | M14: C32 | N14: s (min size) | O14: Explorer 16, Ethernet PICtail Plus
A15: PIC18F8722 | B15: 10 | C15: ENC624J600(3) | D15: SPI, 10 MHz | E15: 28 | F15: 74 | G15: 80 | H15: 114 | I15: =IF(E15>0.2/0.1, IF(ISNUMBER(E15),0.2/0.1,E15),E15) -> 2 | J15: =IF(F15>2/0.1, IF(ISNUMBER(F15),2/0.1,F15),F15) -> 20 | K15: =IF(G15>8/0.1, IF(ISNUMBER(G15),8/0.1,G15),G15) -> 80 | L15: =H15 -> 114 | M15: C18 | N15: Debug | O15: PIC18 Explorer, Fast 100Mbps Ethernet PICtail Plus
A16: PIC24FJ128GA010 | B16: 16 | C16: ENC624J600(3) | D16: SPI, 8 MHz | E16: 57 | F16: 159 | G16: 176 | H16: 283 | I16: =IF(E16>0.2/0.1, IF(ISNUMBER(E16),0.2/0.1,E16),E16) -> 2 | J16: =IF(F16>2/0.1, IF(ISNUMBER(F16),2/0.1,F16),F16) -> 20 | K16: =IF(G16>8/0.1, IF(ISNUMBER(G16),8/0.1,G16),G16) -> 80 | L16: =H16 -> 283 | M16: C30 | N16: s (min size) | O16: Explorer 16, Fast 100Mbps Ethernet PICtail Plus
A17: dsPIC33FJ256GP710(2) | B17: 40 | C17: ENC624J600(3) | D17: SPI, 8 MHz | E17: 85 | F17: 260 | G17: 310 | H17: 560 | I17: =IF(E17>0.2/0.1, IF(ISNUMBER(E17),0.2/0.1,E17),E17) -> 2 | J17: =IF(F17>2/0.1, IF(ISNUMBER(F17),2/0.1,F17),F17) -> 20 | K17: =IF(G17>8/0.1, IF(ISNUMBER(G17),8/0.1,G17),G17) -> 80 | L17: =H17 -> 560 | M17: C30 | N17: s (min size) | O17: Explorer 16, Fast 100Mbps Ethernet PICtail Plus
A18: PIC32MX360F512L | B18: 80 | C18: ENC624J600(3) | D18: SPI, 13.33 MHz | E18: 102 | F18: 340 | G18: 420 | H18: 704 | I18: =IF(E18>0.2/0.1, IF(ISNUMBER(E18),0.2/0.1,E18),E18) -> 2 | J18: =IF(F18>2/0.1, IF(ISNUMBER(F18),2/0.1,F18),F18) -> 20 | K18: =IF(G18>8/0.1, IF(ISNUMBER(G18),8/0.1,G18),G18) -> 80 | L18: =H18 -> 704 | M18: C32 | N18: s (min size) | O18: Explorer 16, Fast 100Mbps Ethernet PICtail Plus
A19: PIC32MX795F512L | B19: 80 | C19: ENC624J600(3) | D19: SPI, 13.33 MHz | E19: 100 | F19: 350 | G19: 460 | H19: 807 | I19: =IF(E19>0.2/0.1, IF(ISNUMBER(E19),0.2/0.1,E19),E19) -> 2 | J19: =IF(F19>2/0.1, IF(ISNUMBER(F19),2/0.1,F19),F19) -> 20 | K19: =IF(G19>8/0.1, IF(ISNUMBER(G19),8/0.1,G19),G19) -> 80 | L19: =H19 -> 807 | M19: C32 | N19: s (min size) | O19: Explorer 16, Fast 100Mbps Ethernet PICtail Plus
A20: PIC24FJ128GA010 | B20: 16 | C20: ENC624J600(3) | D20: PSP Mode 5, PMP | E20: 94 | F20: 287 | G20: 328 | H20: 568 | I20: =IF(E20>0.2/0.1, IF(ISNUMBER(E20),0.2/0.1,E20),E20) -> 2 | J20: =IF(F20>2/0.1, IF(ISNUMBER(F20),2/0.1,F20),F20) -> 20 | K20: =IF(G20>8/0.1, IF(ISNUMBER(G20),8/0.1,G20),G20) -> 80 | L20: =H20 -> 568 | M20: C30 | N20: s (min size) | O20: Explorer 16, Fast 100Mbps Ethernet PICtail Plus
A21: dsPIC33FJ256GP710(2) | B21: 40 | C21: ENC624J600(3) | D21: PSP Mode 5, Bitbang | E21: 140 | F21: 620 | G21: 840 | H21: 2032 | I21: =IF(E21>0.2/0.1, IF(ISNUMBER(E21),0.2/0.1,E21),E21) -> 2 | J21: =IF(F21>2/0.1, IF(ISNUMBER(F21),2/0.1,F21),F21) -> 20 | K21: =IF(G21>8/0.1, IF(ISNUMBER(G21),8/0.1,G21),G21) -> 80 | L21: =H21 -> 2032 | M21: C30 | N21: s (min size) | O21: Explorer 16, Fast 100Mbps Ethernet PICtail Plus
A22: PIC32MX360F512L | B22: 80 | C22: ENC624J600(3) | D22: PSP Mode 5, PMP | E22: 150 | F22: 670 | G22: 990 | H22: 2048 | I22: =IF(E22>0.2/0.1, IF(ISNUMBER(E22),0.2/0.1,E22),E22) -> 2 | J22: =IF(F22>2/0.1, IF(ISNUMBER(F22),2/0.1,F22),F22) -> 20 | K22: =IF(G22>8/0.1, IF(ISNUMBER(G22),8/0.1,G22),G22) -> 80 | L22: =H22 -> 2048 | M22: C32 | N22: s (min size) | O22: Explorer 16, Fast 100Mbps Ethernet PICtail Plus
A23: PIC32MX795F512L(3) | B23: 80 | C23: Internal 100BaseTX | D23: - | E23: 195 | F23: 1100 | G23: 2300 | H23: 8738 | I23: =IF(E23>0.2/0.1, IF(ISNUMBER(E23),0.2/0.1,E23),E23) -> 2 | J23: =IF(F23>2/0.1, IF(ISNUMBER(F23),2/0.1,F23),F23) -> 20 | K23: =IF(G23>8/0.1, IF(ISNUMBER(G23),8/0.1,G23),G23) -> 80 | L23: =H23 -> 8738 | M23: C32 | N23: s (min size) | O23: PIC32 Ethernet Starter Kit
A24: PIC18F97J60 | B24: 10.4 | C24: MRF24WB0M | D24: SPI, 10.4 MHz | E24: 6 | F24: 25 | G24: 31 | H24: 40 | I24: =IF(E24>0.2/0.1, IF(ISNUMBER(E24),0.2/0.1,E24),E24) -> 2 | J24: =IF(F24>2/0.1, IF(ISNUMBER(F24),2/0.1,F24),F24) -> 20 | K24: =IF(G24>8/0.1, IF(ISNUMBER(G24),8/0.1,G24),G24) -> 31 | L24: =H24 -> 40 | M24: C18 | N24: Debug | O24: PICDEM.net 2, MRF24WB0MA Wi-Fi PICtail Plus
A25: PIC24FJ256GB110 | B25: 16 | C25: MRF24WB0M | D25: SPI, 8 MHz | E25: 8 | F25: 48 | G25: 68 | H25: 70 | I25: =IF(E25>0.2/0.1, IF(ISNUMBER(E25),0.2/0.1,E25),E25) -> 2 | J25: =IF(F25>2/0.1, IF(ISNUMBER(F25),2/0.1,F25),F25) -> 20 | K25: =IF(G25>8/0.1, IF(ISNUMBER(G25),8/0.1,G25),G25) -> 68 | L25: =H25 -> 70 | M25: C30 | N25: s (min size) | O25: Explorer 16, MRF24WB0MA Wi-Fi PICtail Plus
A26: dsPIC33FJ256GP710(2) | B26: 40 | C26: MRF24WB0M | D26: SPI, 8 MHz | E26: 11 | F26: 75 | G26: 124 | H26: 70 | I26: =IF(E26>0.2/0.1, IF(ISNUMBER(E26),0.2/0.1,E26),E26) -> 2 | J26: =IF(F26>2/0.1, IF(ISNUMBER(F26),2/0.1,F26),F26) -> 20 | K26: =IF(G26>8/0.1, IF(ISNUMBER(G26),8/0.1,G26),G26) -> 80 | L26: =H26 -> 70 | M26: C30 | N26: s (min size) | O26: Explorer 16, MRF24WB0MA Wi-Fi PICtail Plus
A27: PIC32MX360F512L | B27: 80 | C27: MRF24WB0M | D27: SPI, 20 MHz | E27: 11 | F27: 75 | G27: 120 | H27: 70 | I27: =IF(E27>0.2/0.1, IF(ISNUMBER(E27),0.2/0.1,E27),E27) -> 2 | J27: =IF(F27>2/0.1, IF(ISNUMBER(F27),2/0.1,F27),F27) -> 20 | K27: =IF(G27>8/0.1, IF(ISNUMBER(G27),8/0.1,G27),G27) -> 80 | L27: =H27 -> 70 | M27: C32 | N27: s (min size) | O27: Explorer 16, MRF24WB0MA Wi-Fi PICtail Plus
A28: PIC32MX795F512L | B28: 80 | C28: MRF24WB0M | D28: SPI, 20 MHz | E28: 11 | F28: 76 | G28: 121 | H28: 70 | I28: =IF(E28>0.2/0.1, IF(ISNUMBER(E28),0.2/0.1,E28),E28) -> 2 | J28: =IF(F28>2/0.1, IF(ISNUMBER(F28),2/0.1,F28),F28) -> 20 | K28: =IF(G28>8/0.1, IF(ISNUMBER(G28),8/0.1,G28),G28) -> 80 | L28: =H28 -> 70 | M28: C32 | N28: s (min size) | O28: Explorer 16, MRF24WB0MA Wi-Fi PICtail Plus
A30: 1. Internet throughput with acknowledged protocols, such as TCP, are capped by the formula (Buffer Size)/(Ping Time). Assuming round trip acknowledgement latency cannot be controlled, bigger buffers must be used to increase throughput. Internet performance is derived from LAN throughput and is not measured.
A31: 2. Stack performance with a dsPIC33F is identical to a PIC24H device at the same processor clock. No DSP features are used by the TCP/IP stack.
A32: 3. ENC624J600 and PIC32MX7XX/6XX Internal 100BaseTX Ethernet measurements are done in 100Mbps, full duplex mode.